{
  "schema_version": 1,
  "last_updated": "2026-05-11",
  "comment": "Slim by-team index. Authoritative members + project + prize data live in data/nvc.json; full outcome detail lives in data/outcomes.json. This file is a quick lookup keyed by team name.",
  "teams": [
    {"name": "AegleBio", "years": [2026], "top_award": "Semi-finalist", "outcome": null},
    {"name": "Apeel Juice", "years": [2018], "top_award": "Track Award (Social Enterprise) 1st", "outcome": {"category": "NO_PUBLIC_OUTCOME_FOUND", "see": "OUTCOMES.md#2018"}},
    {"name": "APIC Diagnostics", "years": [2017], "top_award": "Tech Surge 2nd", "outcome": {"category": "NO_PUBLIC_OUTCOME_FOUND", "see": "OUTCOMES.md#2017"}},
    {"name": "Ardha Health", "years": [2020], "top_award": "Track Award (Business Products) 1st", "outcome": null},
    {"name": "ARTEM", "years": [2018], "top_award": "Track Award (Consumer Products) 1st", "outcome": {"category": "NO_PUBLIC_OUTCOME_FOUND", "see": "OUTCOMES.md#2018"}},

    {"name": "Baby Box", "name_aliases": ["123 Baby Box"], "years": [2020], "top_award": "Grand Prize", "outcome": {"category": "OPERATING", "rebranded_to": "123 Baby Box", "total_funding_usd_approx": 1200000, "see": "OUTCOMES.md#2020"}},
    {"name": "BagIt", "years": [2024], "top_award": "Track Award (Business Products) 2nd", "outcome": null},
    {"name": "Billify", "years": [2026], "top_award": "Semi-finalist", "outcome": null},
    {"name": "Bloom Diagnostics", "years": [2013], "top_award": "UC Irvine Environment Institute Award", "outcome": null},
    {"name": "Blue Aqua Food Tech", "years": [2022], "top_award": "Track Award (Social Enterprise) 1st", "outcome": {"category": "OPERATING", "see": "OUTCOMES.md#2022"}},
    {"name": "Bottle Built", "years": [2020], "top_award": "Audience Favorite", "outcome": {"category": "NO_PUBLIC_OUTCOME_FOUND", "see": "OUTCOMES.md#2020"}},
    {"name": "Bottle Rocket", "years": [2016], "top_award": "Finalist (track placement not preserved)", "outcome": null},
    {"name": "BrainCheck", "years": [2017], "top_award": "Track Award (Consumer Products) 1st", "outcome": {"category": "NO_PUBLIC_OUTCOME_FOUND", "see": "OUTCOMES.md#2017"}},

    {"name": "CannTek", "years": [2020], "top_award": "Track Award (Life Sciences) 2nd", "outcome": null},
    {"name": "Carbo", "years": [2016], "top_award": "Finalist (track placement not preserved)", "outcome": null},
    {"name": "CarDana", "years": [2018], "top_award": "Track Award (Social Enterprise) 2nd", "outcome": {"category": "OPERATING", "see": "OUTCOMES.md#2018"}},
    {"name": "Celebrate in a Snap", "years": [2018], "top_award": "Track Award (Business Products) 1st", "outcome": null},
    {"name": "CeleriBio", "years": [2016], "top_award": "Finalist (track placement not preserved)", "outcome": null},
    {"name": "ChewRank", "years": [2023], "top_award": "Track Award (Consumer Services) 2nd", "outcome": null},
    {"name": "Circular", "years": [2021], "top_award": "Track Award (Social Enterprise) 1st", "outcome": {"category": "NO_PUBLIC_OUTCOME_FOUND", "see": "OUTCOMES.md#2021"}},
    {"name": "CleanHydro", "years": [2025], "top_award": "Track Award (Social Enterprise) 1st", "outcome": null},
    {"name": "Closed Loop Plastics", "years": [2018], "top_award": "Tech Surge 2nd", "outcome": {"category": "SHUT_DOWN", "see": "OUTCOMES.md#2018"}},
    {"name": "COMPAS", "years": [2017], "top_award": "Track Award (Business Products) 2nd", "outcome": null},
    {"name": "Conshus Clothing", "years": [2020], "top_award": "Track Award (Social Enterprise) 1st", "outcome": {"category": "NO_PUBLIC_OUTCOME_FOUND", "see": "OUTCOMES.md#2020"}},
    {"name": "Crafty Palate", "years": [2024], "top_award": "Track Award (Consumer Services) 2nd", "outcome": {"category": "DORMANT", "see": "OUTCOMES.md#2024"}},
    {"name": "Curaflow", "years": [2016], "top_award": "Finalist (track placement not preserved)", "outcome": null},
    {"name": "Curbd / SwappIt", "years": [2019], "top_award": "Track Award (Consumer Services) 2nd (tied)", "outcome": null},

    {"name": "Dental Insights", "years": [2016], "top_award": "Finalist (track placement not preserved)", "outcome": null},
    {"name": "DermaVision", "name_aliases": ["DermaVision Technologies"], "years": [2024], "top_award": "Track Award (Social Enterprise) 2nd", "outcome": {"category": "OPERATING", "note": "Student-team stage; placed 3rd at 2024 BMES Medtronic Design Competition", "see": "OUTCOMES.md#2024"}},

    {"name": "Eater Zone", "years": [2017], "top_award": "Track Award (Consumer Services) 2nd", "outcome": null},
    {"name": "ELF Therapeutics", "name_aliases": ["eLysis"], "years": [2019], "top_award": "Tech Surge 1st + Track Award (Life Sciences) 1st", "outcome": {"category": "OPERATING", "rebranded_to": "eLysis", "see": "OUTCOMES.md#2019"}},
    {"name": "Element: B2B2C", "years": [2017], "top_award": "Track Award (Business Products) 1st", "outcome": null},
    {"name": "EmbryLux", "years": [2016], "top_award": "Grand Prize", "outcome": {"category": "NO_PUBLIC_OUTCOME_FOUND", "see": "OUTCOMES.md#pre-2017"}},
    {"name": "Embryologic", "years": [2019], "top_award": "Track Award (Life Sciences) 2nd", "outcome": null},
    {"name": "EmpowerMi", "years": [2022], "top_award": "Track Award (Business Products) 2nd", "outcome": null},
    {"name": "Enjovu Paper", "years": [2022], "top_award": "Runner-Up", "outcome": {"category": "NO_PUBLIC_OUTCOME_FOUND", "see": "OUTCOMES.md#2022"}},
    {"name": "Esqalate", "years": [2017], "top_award": "Track Award (Poverty Alleviation) 1st", "outcome": {"category": "DORMANT", "see": "OUTCOMES.md#2017"}},

    {"name": "Failsafe", "years": [2017], "top_award": "Track Award (Consumer Products) 2nd", "outcome": null},
    {"name": "First Step Diagnostics", "years": [2018], "top_award": "Tech Surge 1st + Track Award (Life Sciences) 2nd", "outcome": {"category": "NO_PUBLIC_OUTCOME_FOUND", "see": "OUTCOMES.md#2018"}},
    {"name": "Flare", "years": [2024], "top_award": "Track Award (Consumer Products) 1st", "outcome": null},
    {"name": "forMED Technologies", "years": [2022], "top_award": "Track Award (Life Sciences) 1st", "outcome": {"category": "NO_PUBLIC_OUTCOME_FOUND", "see": "OUTCOMES.md#2022"}},
    {"name": "FunBand", "years": [2016], "top_award": "Finalist (track placement not preserved)", "outcome": null},

    {"name": "GaleGauge", "years": [2022], "top_award": "Track Award (Consumer Products) 2nd", "outcome": null},
    {"name": "Gimme", "years": [2018], "top_award": "Track Award (Consumer Products) 2nd", "outcome": null},
    {"name": "giv", "years": [2019], "top_award": "Track Award (Social Enterprise) 2nd", "outcome": null},
    {"name": "GlowGuard", "years": [2025], "top_award": "Runner-Up", "outcome": {"category": "OPERATING", "note": "brand new", "see": "OUTCOMES.md#2025"}},
    {"name": "Grad2Go", "years": [2025, 2026], "top_award": "Grand Prize (2025); semi-finalist (2026)", "outcome": {"category": "OPERATING", "note": "brand new; competing again in 2026", "see": "OUTCOMES.md#2025"}},
    {"name": "Graduate Data", "years": [2018], "top_award": "Track Award (Consumer Services) 2nd", "outcome": null},

    {"name": "HAI", "years": [2022], "top_award": "Track Award (Consumer Products) 1st", "outcome": null},
    {"name": "Happy Sleep", "years": [2009], "top_award": "Undergraduate division winner ($3,500 + Best Concept Paper)", "outcome": null},
    {"name": "Health Libero", "years": [2021], "top_award": "Track Award (Business Products) 2nd", "outcome": null},
    {"name": "Helios", "years": [2023], "top_award": "Track Award (Business Products) 1st", "outcome": null},
    {"name": "Help Belt", "years": [2023], "top_award": "Track Award (Consumer Products) 1st", "outcome": null},
    {"name": "Hydroflow", "years": [2021], "top_award": "Track Award (Consumer Products) 2nd", "outcome": null},
    {"name": "HydroVasc", "years": [2021], "top_award": "Track Award (Life Sciences) 2nd", "outcome": null},
    {"name": "Hyperion Therapeutics", "years": [2023], "top_award": "Track Award (Life Sciences) 1st", "outcome": {"category": "OPERATING", "see": "OUTCOMES.md#2023"}},

    {"name": "iBesties", "name_aliases": ["Middle School Moguls"], "years": [2014], "top_award": "Grand Prize", "outcome": {"category": "PIVOTED", "rebranded_to": "Middle School Moguls", "see": "OUTCOMES.md#pre-2017"}},
    {"name": "ImmunoTarget", "name_aliases": ["ImmunoTarget Therapeutics"], "years": [2020], "top_award": "Track Award (Life Sciences) 1st", "outcome": {"category": "OPERATING", "see": "OUTCOMES.md#2020"}},
    {"name": "Instinct", "years": [2020], "top_award": "Track Award (Business Products) 2nd", "outcome": null},

    {"name": "Jam", "years": [2016], "top_award": "Finalist (track placement not preserved)", "outcome": null},
    {"name": "Jiffal", "years": [2019], "top_award": "Track Award (Business Products) 2nd", "outcome": null},

    {"name": "Laser Associated Sciences", "name_aliases": ["LAS"], "years": [2013], "top_award": "Grand Prize", "outcome": {"category": "ACQUIRED", "acquirer": "Medtronic", "acquisition_date": "2020-04", "see": "OUTCOMES.md#pre-2017"}},
    {"name": "Leprendo", "years": [2023], "top_award": "Runner-Up", "outcome": {"category": "OPERATING", "see": "OUTCOMES.md#2023"}},
    {"name": "Lynne", "years": [2024], "top_award": "Track Award (Consumer Products) 2nd", "outcome": null},

    {"name": "Maslow Construction Robots", "years": [2016], "top_award": "Finalist (track placement not preserved)", "outcome": null},
    {"name": "MEGAL!NE", "years": [2013], "top_award": "TechPortal Calit2 Residency Award", "outcome": null},
    {"name": "Mechanodontics", "name_aliases": ["BRIUS Technologies"], "years": [2018], "top_award": "Track Award (Life Sciences) 1st", "outcome": {"category": "OPERATING", "rebranded_to": "BRIUS Technologies", "total_funding_usd_approx": 46000000, "see": "OUTCOMES.md#2018"}},